<?xml version="1.0" encoding="UTF-8"?>
<!DOCTYPE jlc SYSTEM "jlc.dtd">
<jlc>
<student sid="11" job="yes">
	<sname>sri</sname>
	<email>
		<oemail>sri@jlc.com</oemail>
		<pemail>gg@jlc.com</pemail>
	</email>
</student>
<course cid="101" free="true">
		<cname>XML</cname>
		<cost>101</cost>
		<faculty>&f1;</faculty>
</course>
</jlc>