<?xml version="1.0" encoding="UTF-8"?>
<!DOCTYPE JLC SYSTEM "jlc.dtd">
<jlc>
	<student sid="11" job="yes">
		<sname>sri</sname>	
		<email>
		<oemail>sri@jl.com</oemail>
		<pemail>ga@jl.com</pemail>
		</email>
	</student>
	<student sid="12" job="no">
		<sname>vas</sname>	
		<email>
		<oemail>sdf@jl.com</oemail>
		<pemail>dfd@jl.com</pemail>
		</email>
	</student>
	<course cid="101" free="yes">
		<cname>XML</cname>
		<cost>500</cost>
		<faculty>&f1;</faculty>
	</course>
	<course cid="102">
		<cname>WS</cname>
		<cost>4500</cost>
		<faculty>&f1;</faculty>
	</course>		
</jlc>